{
  "assessmentId": "ASM-2026-ABCD",
  "assessmentVersion": 1,
  "applicationId": "PK-2026-0001",
  "caseRevisionId": "CASE-2026-ABCD-R0002",
  "scope": {
    "purpose": "NEW_LOAN",
    "product": "KREDIT_MODAL_KERJA",
    "simulation": false
  },
  "policy": {
    "pack": "produktif",
    "version": "1.0.3",
    "fingerprint": "sha256-policy-hash"
  },
  "quality": {
    "completeness": 96,
    "readiness": {
      "readyForScoring": true,
      "readyForCommittee": false
    },
    "capabilities": {
      "identity": "READY",
      "financial": "READY",
      "collateral": "MISSING"
    }
  },
  "assumptions": [
    {
      "code": "SEASONAL_REVENUE",
      "description": "Omzet menggunakan rata-rata 12 bulan."
    }
  ],
  "constraints": [
    "MAX_TENOR_60",
    "MIN_DSCR_1_2"
  ],
  "caseSnapshot": {
    "revisionId": "CASE-2026-ABCD-R0002",
    "data": {
      "application": { "applicationId": "PK-2026-0001" },
      "agunan": []
    }
  },
  "integrity": {
    "fingerprint": "sha256-context-hash",
    "algorithm": "SHA-256"
  }
}
